Synset ID,Definition,Members,Previous Hypernyms,New Hypernym ID,New Hypernym Definition,New Hypernym Members,True Hypernym,Frame change,
01116393-v,maintain a required pace or level,keep up,,02687605-v,"cause to continue in a certain state, position, or activity","keep, maintain, hold",x,,
00118572-v,keep informed,"keep up, keep abreast, follow",,02173796-v,,observe,x,,
02624202-v,continue to live and avoid dying,"survive, last, live, live on, go, endure, hold up, hold out",,02690747-v,"continue a certain state, condition, or activity","continue, go on, proceed, go along, keep",x,,
00813037-v,stay clear from; keep away from; keep out of the way of someone or something,avoid,,00798638-v,,reject,x,,
02715780-v,extend in a different direction,diverge,,02691775-v,"stretch out over a distance, space, time, or scope; run or extend between two points or beyond a certain point","run, go, pass, lead, extend",x,,
01068455-v,"present somebody with something, usually to accuse or criticize","confront, face, present",,00775012-v,,present,,x,
02468933-v,refrain from doing something,avoid,,02731589-v,resist doing something,"refrain, forbear",,x,
00939649-v,refrain from divulging sensitive information; keep quiet about confidential information,"keep quiet, shut one's mouth, keep one's mouth shut",,02731589-v,resist doing something,"refrain, forbear",,x,
01042933-v,refuse to talk or stop talking; fall silent,"close up, clam up, dummy up, shut up, belt up, button up, be quiet, keep mum",,02731589-v,resist doing something,"refrain, forbear",,x,
01838427-v,remain in place; hold still; remain fixed or immobile,stand still,,02733337-v,"continue in a place, position, or situation","stay, stay on, continue, remain",x,,
01779986-v,to remain emotionally or intellectually attached,cling,,02543752-v,,attach,x,,
02252172-v,be sold for a certain price,"fetch, bring in, bring",,02733758-v,be sold at a certain price or in a certain way,sell,x,,
02202019-v,be perceived by,greet,,02736201-v,be beset by,"run into, encounter",,x,
02653900-v,endure,stick,01861378-v,01861378-v,stay behind,"persist, remain, stay",x,,
02737117-v,remain present although waning or gradually dying,linger,01861378-v,01861378-v,stay behind,"persist, remain, stay",x,,
02013215-v,remain behind,stay,,01861378-v,stay behind,"persist, remain, stay",x,,
02633747-v,come from,originate in,,02749089-v,be a native of,"hail, come",x,,
02776128-v,"rain, hail, or snow hard and be very windy, often with thunder or lightning",storm,,02762779-v,fall from clouds,"precipitate, come down, fall",x,,
02769698-v,"emit light; be bright, as of the sun or a light","shine, beam",,02773266-v,"give off, send forth, or discharge; as of light, heat, or radiation, vapor, etc.","emit, give out, give off",,x,
02139513-v,give off a certain sound or sounds,sound,,02773266-v,"give off, send forth, or discharge; as of light, heat, or radiation, vapor, etc.","emit, give out, give off",,x,
02663315-v,,,02670846-v,02622439-v,,be,,,
02753584-v,,continue,,00340744-v,,happen,,,
01860082-v,,move in,,01839438-v,,move,,,
02598823-v,,tutor,,02463535-v,,relate,,,
01019231-v,,predicate,,02463535-v,,relate,,,
02145254-v,,close,,00353480-v,,end,,,
02364227-v,,carry,,02208144-v,,have,,,
00739481-v,,"grab, seize",,01825361-v,,interest,,,