Synset,Children,Lemmas,Definitions,Hypernym Lemma,Hypernym ID
01824240-v,2,"enjoy, bask, relish, savor, savour","derive or receive pleasure from; get enjoyment from; take pleasure in",feel,01775456-v
02133118-v,1,"watch, look on","observe with attention",observe,01022014-v
02427979-v,1,"let, allow, permit","make it possible through a specific action or lack of action for something to happen",make,01620211-v
02429499-v,1,"oppress, suppress, crush","come down on or keep down by unjust use of one's authority",act,02372362-v
02431018-v,1,"open, open up","start to operate or function or cause to start operating or functioning",start,00346415-v
01328218-v,1,"kill","cause the death of, without intention",cause,00772482-v
02567247-v,1,"practice, apply, use","avail oneself to",act,02372362-v
02572007-v,1,"fall","lose one's chastity",lose,02292634-v
02574587-v,1,"practice, practise, exercise, do","carry out or practice; as of jobs and professions",engage,02380222-v
02584957-v,1,"observe, keep","conform one's action or practice to",follow,02547977-v
02601837-v,1,"rest","be inactive, refrain from acting",be,02610777-v
02604140-v,1,"assemble, gather, get together","get people together",collect,02309962-v
02625202-v,1,"last out, stay, ride out, outride","hang on during a trial of endurance",hang on,00351115-v
02633747-v,1,"originate in","come from",come,02749089-v
02635337-v,1,"obviate, rid of, eliminate","get rid of something",get rid of,02228837-v
02669057-v,1,"conform","be similar, be in line with",be,02610777-v
02671069-v,1,"amount","be tantamount or equivalent to",be,02610777-v
02674312-v,1,"violate, go against, break","fail to agree with; be in violation of; as of rules or patterns",fail,02534950-v
02675266-v,1,"exceed, transcend, surpass","be greater in scope or size than some standard",be,02610777-v
02709149-v,1,"yield, relent, soften","give in, as to influence or pressure",give in,00799359-v
02716276-v,1,"converge, meet","be adjacent or come together",be,02610777-v
02209880-v,1,"have","have left",delete,delete
02747024-v,1,"range","have a range; be capable of projecting over a certain distance, as of a gun",be,02610777-v
02771422-v,1,"absorb, take in","suck or take up or in",take up,01543237-v
02516942-v,1,"indulge","give free rein to",give,02321848-v
02539728-v,1,"waive, relinquish, forgo, forego, foreswear, dispense with","do without or cease to hold or adhere to",act,02372362-v
01852000-v,1,"fly","cause to fly or float",cause,00772482-v
01852297-v,1,"stay in place","be stationary",be,02610777-v
01884666-v,1,"beat","indicate by beating, as with the fingers or drumsticks",indicate,00923271-v
02085825-v,1,"leave behind","depart and not take along",depart,01852660-v
00014542-v,1,"be active, move","be in a state of action",be,02610777-v
01720741-v,1,"play","be performed or presented for public viewing",act,02372362-v
00017275-v,1,"fall asleep, dope off, flake out, drift off, nod off, drop off, doze off, drowse off","change from a waking to a sleeping state",change,00122978-v
00020126-v,1,"wake","be awake, be alert, be there",be,02610777-v
00100659-v,1,"warm up","cause to do preliminary exercises so as to stretch the muscles",cause,00772482-v
00107747-v,1,"fracture","break (a bone)",delete,delete
02122959-v,1,"notice, mark, note","notice or perceive",perceive,02110960-v
02123706-v,1,"ignore","fail to notice",fail,02534950-v
02151220-v,1,"conceal, hold back, hold in","hold back; keep from being perceived by others",keep,02687605-v
02132531-v,1,"discover","see for the first time; make a discovery",perceive,02110960-v
02161530-v,1,"produce, bring on, bring out","bring onto the market or release",act,02372362-v
02132318-v,1,"miss, lose","fail to perceive or to catch with the senses or the mind",fail,02534950-v
02198732-v,1,"taste, savor, savour","have flavor; taste of something",have,02208144-v
00593432-v,1,"resonate, come across","be received or understood",be,02610777-v
00597527-v,1,"know","have fixed in the mind",have,02208144-v
00610654-v,1,"forget, block, blank out, draw a blank","be unable to remember",think,00630153-v
02292463-v,1,"lose","miss from one's possessions; lose sight of",miss,02638434-v
00614907-v,1,"abandon, give up","stop maintaining or insisting on; of ideas or claims",,
00617843-v,1,"neglect","fail to attend to",,
00618547-v,1,"neglect, ignore, disregard","give little or no attention to",,
00638550-v,1,"establish, base, ground, found","use as a basis for; found on",,
00681308-v,1,"choose, prefer, opt","select as an alternative over another",,
00738221-v,1,"analyze, analyse","break down into components or essential features",,
01084999-v,1,"enter, participate","become a participant; be involved in",,
01096197-v,1,"campaign, take the field","go on a campaign; go off to war",,
01116393-v,1,"keep up","maintain a required pace or level",,
01120499-v,1,"submit","yield to the control of another",,
00258995-v,1,"leak","have an opening that allows light or substances to enter or go out",,
01993576-v,1,"collapse, burst","cause to burst",cause,00772482-v
00360745-v,1,"leave, leave behind","be survived by after one's death",,
00415969-v,1,"settle","form a community",,
00975760-v,1,"air","be broadcast",,
02552922-v,1,"dishonor, disgrace, dishonour, attaint, shame","bring shame or dishonor upon",,
01328456-v,1,"kill","deprive of life",,
01339317-v,1,"overlay, cover","put something on top of something else",,
01377960-v,1,"splash","strike and dash about in a liquid",,
01460857-v,1,"percolate","cause (a solvent) to pass through a permeable substance in order to extract a soluble constituent",cause,00772482-v
02293000-v,1,"lose","fail to get or obtain",,
00781646-v,1,"rest","give a rest to",,
00922307-v,1,"determine, check, find out, see, ascertain, watch, learn","find out, learn, or determine with certainty, usually by making an inquiry or other effort",,
00938019-v,1,"break, get out, get around","be released or become known; of news",,
01008855-v,1,"correspond","exchange messages",,
02209474-v,1,"own, have, possess","have ownership or possession of",,
02270824-v,1,"save, lay aside, save up","accumulate money for future use",,
02258963-v,1,"owe","be obliged to pay or repay",,
02271765-v,1,"save","spend less; buy at a reduced price",,
02214718-v,1,"take, accept","make use of or accept for some purpose",,
01791641-v,1,"madden, craze","cause to go crazy; cause to lose one's mind",cause,00772482-v
02724891-v,1,"sulk, pout, brood","be in a huff and display one's displeasure",,
01814900-v,1,"despair","abandon hope; give up hope; lose heart",,
01817466-v,1,"gladden, joy","make glad or happy",,
