synset,definition,members,transitive definition,intransitive definition,notes
01039782-v,"talk or behave amorously, without serious intentions",chat up; flirt; dally; butterfly; coquet; coquette; romance; philander; mash,,,
01041202-v,communicate silently and non-verbally by signals or signs,sign; signal; signalize; signalise,,,
01041726-v,make known with a word or signal,signify,,,
01042272-v,signal by means of a mirror and the using the sun's rays,heliograph,,,
01042422-v,communicate or signal with a flag,flag,,,
01043287-v,signal with the hands or nod,beckon; wave,,,
01045313-v,utter or express by whistling,whistle,,,
01045986-v,speak softly or indistinctly,murmur,,,
01046405-v,talk indistinctly; usually in a low voice,mumble; mutter; maunder; mussitate,,,
01049945-v,utter in deep prolonged tones,bay,,,
01050441-v,shout loudly and without restraint,bawl; bellow,,,
01051342-v,sing softly,croon,,,
01051609-v,recite with musical intonation; recite as a chant or a psalm,chant; intone; intonate; cantillate,,,
01052037-v,"speak, chant, or declaim in a singsong",singsong,,,
01052768-v,"sing or play with trills, alternating with the half note above or below",warble; trill; quaver,,,
01053236-v,recite in elocution,declaim; recite,,,
01056058-v,express or utter with a hiss,hiss; sizz; siss; sibilate,,,
01057701-v,sing with closed lips,hum,,,
01058426-v,talk or utter in a cackling manner,cackle,,,
01059214-v,jam an entire frequency spectrum,barrage jam,,,
01059430-v,jam a narrow band of frequencies,point jam,,,
01059581-v,jam a single frequency,spot jam,,,
01059709-v,jam a broad spectrum of frequencies to affect all communications in the area except for directional antenna communications,blanket jam,,,
01060446-v,make or write a comment on,comment; notice; remark; point out,,,
01061436-v,refuse to acknowledge,ignore; disregard; snub; cut,,,
01064761-v,"send a message or attempt to reach someone by radio, phone, etc.; make a signal to in order to transmit a message",call,,,
01067652-v,"utter meaningless sounds, like a baby, or utter in an incoherent way",babble,,,
01069838-v,to make melodious sounds,sing,,,
01072477-v,give the etymology or derivation or suggest an etymology (for a word),etymologize; etymologise,,,
90000001-v,To post a message on Twitter,tweet,,,
02205670-v,give a present that one has received to someone else,regift,,,
02207166-v,retain possession of,keep; hold on,,,
02210922-v,get credit or money by using a bad check,kite,,,
02211988-v,obtain by purchase; acquire by means of a financial transaction,buy; purchase,,,
02214527-v,receive or obtain regularly,subscribe; subscribe to; take,,,
02218118-v,get something or somebody for a specific purpose,line up; get hold; come up; find,,,
02225243-v,cause to change ownership,transfer,,,
02226236-v,transmit a title or property,convey,,,
02229563-v,remove something that has been rejected,cull,,,
02236255-v,throw (a ball) to another player,pass,,,
02243318-v,get (a product) from another country or business,source,,,
02244187-v,"secure a place in a college, university, etc.",get in; get into,,,
02246831-v,sell illicit products such as drugs or alcohol,bootleg,,,
02247968-v,"sell securities or commodities or foreign currency that is not actually owned by the seller, who hopes to cover (buy back) the sold items at a lower price and thus to earn a profit",sell short,,,
02249738-v,do business; offer for sale as for one's livelihood,deal; sell; trade,,,
02252366-v,sell or get rid of all one's merchandise,sell out; sell up; liquidize,,,
02254885-v,pay too much,overpay,,,
02255024-v,pay too little,underpay,,,
02255148-v,pay for something before receiving it,prepay,,,
02256551-v,"give money, usually in exchange for goods or services",pay,,,
02257739-v,cancel or discharge a debt,pay up; ante up; pay,,,
02258764-v,be in debt,owe,,,
02263812-v,exchange or give (something) in exchange for,trade; swap; swop; switch,,,
02265577-v,trade or deal a commodity,traffic,,,
02266271-v,act as a broker,broker,,,
02267835-v,give to a charity or good cause,donate,,,
02270824-v,accumulate money for future use,save; lay aside; save up,,,
02275010-v,obtain or seek to obtain by cadging or wheedling,schnorr; shnorr; scrounge; cadge,,,
02275249-v,ask for and get free; be a parasite,mooch; bum; cadge; grub; sponge,,,
02275660-v,ask to obtain free,beg,,,
02275823-v,beg by accosting people in the street and asking for money,panhandle,,,
02280210-v,demand as being one's due or property; assert one's right or title to,claim; lay claim; arrogate,,,
02281983-v,take illegally,rustle; lift,,,
02282148-v,steal in a store,shoplift,,,
02282906-v,take without referencing from someone else's writing or speech; of intellectual property,plagiarize; plagiarise; lift,,,
02293561-v,cheat or trick,cozen,,,
02295310-v,win an athletic letter,letter,,,
02300169-v,"have, give, or receive a share of",partake; share; partake in,,,
02300511-v,use jointly or in common,share,,,
02300803-v,combine into a common fund,pool,,,
02303593-v,propose a payment,offer; bid; tender,,,
02312392-v,impose a fine on,mulct; fine,,,
02313721-v,contribute to some cause,contribute; give; chip in; kick in,,,
02316367-v,remove (a commodity) from (a supply source),withdraw; draw; take out; draw off,,,
02316837-v,take a small amount from,dip,,,
02318886-v,reduce or dispose of; cease to hold (an investment),divest; disinvest,,,
02328600-v,stock excessively,overstock,,,
02328710-v,stock with less than the usual or desirable number or quantity,understock,,,
02329474-v,bestow a quality on,lend; impart; bestow; contribute; add; bring,,,
02330038-v,impart gradually,instill; transfuse,,,
02330401-v,impart a cheap brightness to,tinsel,,,
02350284-v,take illegally; of intellectual property,loot; plunder,,,
02350852-v,import or export without paying customs duties,smuggle,,,
02362227-v,"spend sparingly, avoid the waste of",save; economize; economise,,,
02368741-v,"record, add up, and receive payment for items purchased",check out,,,
01775115-v,irritate,get; get under one's skin,,,
01775456-v,undergo an emotional sensation or be in a particular state of mind,feel; experience,,,
01780648-v,have or feel a dislike or distaste for,dislike,,,
01781131-v,find enjoyable or agreeable,like,,,
01781734-v,love intensely,adore,,,
01784021-v,be afraid or scared of; be frightened of,fear; dread,,,
01798206-v,raise scruples,scruple,,,
01798679-v,experience (emotional) pain,suffer,,,
01800593-v,feel remorse for; feel sorry for; be contrite about,repent; regret; rue,,,
01811849-v,be attractive to,attract; appeal,,,
01824240-v,derive or receive pleasure from; get enjoyment from; take pleasure in,enjoy; bask; relish; savor; savour,,,
01829179-v,feel or have a desire for; want strongly,desire; want,,,
01830126-v,have an inclination for something or some activity,feel like,,,
01830440-v,like better; value more highly,prefer,,,
01832565-v,"have a liking, fondness, or taste (for)",care for,,,
01832678-v,get pleasure from,love; enjoy,,,
